<!ELEMENT Map (MapEntry*)>
<!ATTLIST Map type CDATA #IMPLIED >

<!ELEMENT MapEntry EMPTY>
<!ATTLIST MapEntry
	key CDATA #REQUIRED 
	value CDATA #REQUIRED >